{
  "modules": {
    "PIL": [
      "Image.open"
    ],
    "base64": [],
    "csv": [
      "DictReader",
      "reader"
    ],
    "decimal": [
      "Decimal",
      "getcontext"
    ],
    "io": [
      "BytesIO",
      "StringIO"
    ],
    "math": [
      "fsum"
    ],
    "random": [
      "choice"
    ],
    "re": [
      "compile",
      "findall",
      "search"
    ],
    "string": []
  },
  "kinds": {
    "Decimal": [
      "max"
    ]
  },
  "leaves": {
    "Decimal.max": {
      "effects": "pure",
      "returns": "fresh",
      "cost": "O(1)",
      "why": "a new Decimal (measured: not either argument); Decimal is immutable either way"
    },
    "csv.DictReader": {
      "effects": "pure",
      "returns": "fresh",
      "cost": "input length",
      "over": "an in-memory iterable (a StringIO or a list of lines), never a file",
      "why": "_csv is C; ruled in as a leaf 2026-10-15"
    },
    "csv.reader": {
      "effects": "pure",
      "returns": "fresh",
      "cost": "input length",
      "over": "an in-memory iterable (a StringIO or a list of lines), never a file",
      "why": "_csv is C; ruled in as a leaf 2026-10-15"
    },
    "csv.writer": {
      "effects": "pure",
      "returns": "fresh",
      "cost": "input length",
      "over": "an in-memory iterable (a StringIO or a list of lines), never a file",
      "why": "_csv is C; ruled in as a leaf 2026-10-15"
    },
    "decimal.Decimal": {
      "effects": "pure",
      "returns": "fresh",
      "cost": "digits",
      "why": "a C type used by 10% of cells; ruled a day-one entry (repl-specs 2026-10-15)"
    },
    "decimal.getcontext": {
      "effects": "pure",
      "returns": "internal",
      "cost": "O(1)",
      "why": "the live thread context: never owned"
    },
    "io.BytesIO": {
      "effects": "pure",
      "returns": "fresh",
      "cost": "input length",
      "why": "a fresh writable buffer; its contents are its own"
    },
    "io.StringIO": {
      "effects": "pure",
      "returns": "fresh",
      "cost": "input length",
      "why": "a fresh writable buffer; its contents are its own"
    },
    "math.fsum": {
      "effects": "pure",
      "returns": "fresh",
      "cost": "input length",
      "why": "a new float"
    },
    "random.choice": {
      "effects": "reads-external (the RNG)",
      "returns": "alias(0)",
      "cost": "O(1)",
      "why": "returns one of the sequence's items, never a new object (measured)"
    },
    "re.compile": {
      "effects": "cache",
      "returns": "fresh",
      "cost": "input length",
      "why": "a new pattern object; the re module's pattern cache is observational only"
    },
    "re.findall": {
      "effects": "pure",
      "returns": "fresh",
      "cost": "input length",
      "why": "a new list of matches; the pattern is checked for backtracking before the call"
    },
    "re.search": {
      "effects": "pure",
      "returns": "fresh",
      "cost": "input length",
      "why": "a Match or None; the pattern is checked for backtracking before the call"
    }
  },
  "observed": {
    "modules": {
      "PIL": {
        "Image.fromarray": 1,
        "Image.open": 2
      },
      "base64": {
        "b64encode": 1
      },
      "csv": {
        "DictReader": 3,
        "reader": 11
      },
      "decimal": {
        "Decimal": 143,
        "getcontext": 2
      },
      "io": {
        "BytesIO": 4,
        "StringIO": 33
      },
      "math": {
        "fsum": 3
      },
      "random": {
        "choice": 2,
        "choices": 1
      },
      "re": {
        "DOTALL": 1,
        "I": 1,
        "compile": 2,
        "findall": 3,
        "finditer": 1,
        "search": 3,
        "sub": 1
      },
      "string": {
        "hexdigits": 1,
        "hexdigits.lower": 1
      }
    },
    "kinds": {
      "Decimal": {
        "max": 10,
        "compare": 1,
        "as_tuple": 1
      }
    }
  },
  "min_cells": 2,
  "note": "effects, return marking (fresh/alias(i)/internal) and cost shapes: leafpass.py, second pass 2026-10-18 (docs/spec/READONLY_LIBRARY_MANIFEST.md); a listed name is admitted only with its row"
}
